{
 "id": "EP11",
 "tag": "FINALE",
 "slug": "the_reckoning",
 "beats": [
  {
   "scene": "coldopen",
   "label": "FROM THE FIELD",
   "headline": "The assessment found the gaps. It shipped anyway.",
   "body": "Weaknesses raised, risk noted — then waved through under deadline pressure. Assessment and authorization protect you only when the decision is honest.",
   "min_seconds": 7.0,
   "say": [
    [
     "NULL",
     "Rush the sign-off, bury the findings. That is the door I love best."
    ],
    [
     "VEGA",
     "Tonight, the reckoning — prove the controls work, then decide with eyes open."
    ]
   ]
  },
  {
   "scene": "section",
   "num": "11",
   "title": "THE RECKONING",
   "subtitle": "Assess · Authorize · Monitor",
   "say": [
    [
     "VEGA",
     "The walls are built. But a defense you haven't tested is only a hope."
    ],
    [
     "NARRATOR",
     "Now: assessment, authorization, and the watch that never ends."
    ]
   ]
  },
  {
   "scene": "diagram",
   "title": "How assessors check a control (SP 800-53A)",
   "nodes": [
    {
     "label": "Examine",
     "x": 150,
     "y": 470,
     "w": 460,
     "h": 150,
     "color": "cyan"
    },
    {
     "label": "Interview",
     "x": 730,
     "y": 470,
     "w": 460,
     "h": 150,
     "color": "gold"
    },
    {
     "label": "Test",
     "x": 1310,
     "y": 470,
     "w": 460,
     "h": 150,
     "color": "mint"
    }
   ],
   "arrows": [],
   "say": [
    [
     "VEGA",
     "800-53A gives assessors three methods."
    ],
    [
     "NOVA",
     "Examine, interview, test — three ways to actually prove it works?"
    ]
   ]
  },
  {
   "scene": "points",
   "title": "From assessment to decision",
   "bullets": [
    "Assessors produce a Security Assessment Report (the SAR)",
    "Open weaknesses go on a POA&M — a Plan of Action & Milestones (CA-5)",
    "The POA&M tracks each gap until it's fixed"
   ],
   "kicker": "800-53A · SAR · POA&M",
   "note": "",
   "say": [
    [
     "VEGA",
     "The findings become a report, and every gap gets a plan to close it."
    ]
   ]
  },
  {
   "scene": "points",
   "title": "The paperwork trail — and why it matters",
   "bullets": [
    "Assess → the Security Assessment Report (SAR): what works, what doesn't",
    "Open gaps → the POA&M: each weakness with an owner and a due date",
    "SAR + plan + evidence → the authorization package the AO reviews",
    "AO accepts the residual risk → the ATO: the system may operate"
   ],
   "kicker": "THE ARTIFACT CHAIN",
   "note": "",
   "say": [
    [
     "VEGA",
     "Every step leaves a document. Together, they let a leader make an honest call."
    ],
    [
     "NOVA",
     "So — assess, write up what you found, plan for the gaps, package it, then the AO signs?"
    ]
   ]
  },
  {
   "scene": "control",
   "id": "CA-2",
   "title": "Control Assessments",
   "plain": "Assess whether controls are implemented correctly, operate as intended, and produce the desired outcome.",
   "why": "CA-2 calls for the assessment (independent where required); 800-53A is the how-to.",
   "say": [
    [
     "VEGA",
     "The catalog control behind all this is CA-2."
    ],
    [
     "ARCHIVIST",
     "Select the appropriate assessor or assessment team for the type of assessment to be conducted;"
    ]
   ]
  },
  {
   "scene": "points",
   "title": "Authorization — the ATO",
   "bullets": [
    "A senior leader, the authorizing official, reviews the residual risk",
    "If acceptable, they grant an Authorization to Operate — the ATO (CA-6)",
    "It is a documented acceptance of risk, not a guarantee of safety"
   ],
   "kicker": "800-37 · AUTHORIZE",
   "note": "",
   "say": [
    [
     "NOVA",
     "So someone has to own the risk and sign for it?"
    ],
    [
     "VEGA",
     "Yes. The authorizing official grants the ATO, and owns that decision."
    ],
    [
     "NULL",
     "The ink dries... and I'm already past the next wall."
    ]
   ]
  },
  {
   "scene": "control",
   "id": "CA-7",
   "title": "Continuous Monitoring",
   "plain": "Keep assessing and watching the system continuously, not just once.",
   "why": "Authorization is a point-in-time risk decision; monitoring runs across the system's life to keep risk in view.",
   "say": [
    [
     "VEGA",
     "Which is why the final step never ends: CA-7, continuous monitoring."
    ],
    [
     "VEGA",
     "SP 800-137 is the playbook for that ongoing watch."
    ]
   ]
  },
  {
   "scene": "quiz",
   "q": "What are the three assessment methods in SP 800-53A?",
   "options": [
    "Scan, Patch, Report",
    "Examine, Interview, Test",
    "Plan, Do, Check"
   ],
   "answer": 1,
   "reveal": true,
   "say": [
    [
     "NOVA",
     "Final stretch. Name the three assessment methods."
    ]
   ],
   "min_seconds": 7,
   "why": "SP 800-53A uses three assessment methods: examine, interview, and test."
  },
  {
   "scene": "quiz",
   "q": "A senior official accepts the residual risk and lets the system run. That decision is the?",
   "options": [
    "POA&M",
    "ATO (Authorization to Operate)",
    "SAR"
   ],
   "answer": 1,
   "reveal": true,
   "say": [
    [
     "VEGA",
     "And the decision that lets the system go live?"
    ]
   ],
   "min_seconds": 7,
   "why": "The official's acceptance of residual risk is the Authorization to Operate."
  },
  {
   "scene": "quiz",
   "q": "Where are open weaknesses tracked until they're remediated?",
   "options": [
    "In the SAR",
    "In a POA&M",
    "In FIPS 199"
   ],
   "answer": 1,
   "reveal": true,
   "say": [
    [
     "VEGA",
     "And where do we track the gaps we haven't closed?"
    ]
   ],
   "min_seconds": 7,
   "why": "Open weaknesses are tracked in a POA&M until they're remediated."
  },
  {
   "scene": "points",
   "title": "The campaign, complete",
   "bullets": [
    "Prepare → Categorize → Select → Implement → Assess → Authorize → Monitor",
    "FIPS 199 + 800-60 categorize it; FIPS 200 sets the floor; 800-53B picks the baseline; 800-53 supplies the controls",
    "800-53A assesses; 800-37 runs the process; 800-137 keeps the watch"
   ],
   "kicker": "THE WHOLE PICTURE",
   "note": "",
   "say": [
    [
     "VEGA",
     "Categorize, select, implement, assess, authorize, monitor. You've walked the whole campaign."
    ],
    [
     "NOVA",
     "From a single control... to a system that's authorized and watched for life."
    ]
   ]
  },
  {
   "scene": "title",
   "kicker": "A NIST SP 800-53r5 TRAINING SERIES",
   "badge": "THE CITADEL ENDURES",
   "title": "CYBER CITADEL",
   "subtitle": "An educational aid — always consult the NIST publications",
   "say": [
    [
     "NOVA",
     "In Episode zero, I didn't even know what eight-hundred fifty-three was. Tonight, I finally understand what that signature means."
    ],
    [
     "VEGA",
     "Then keep the watch, Castellan. That's what the signature begins."
    ],
    [
     "NULL",
     "I will return. There is always a next time."
    ],
    [
     "NOVA",
     "Then we never stop watching."
    ],
    [
     "NARRATOR",
     "Episode zero promised: protect it, and you thrive. You protected it. Now you never stop. The story was ours; the controls are real."
    ]
   ],
   "min_seconds": 4
  }
 ]
}